conflict_id,data_category,field,source_1_id,source_1_value,source_2_id,source_2_value,possible_reason,recommended_manual_action,status
C001,hostel,room_occupancy,S006,Official page describes single-room accommodation,SX01,Recent commenters report first-year sharing and single rooms in later years,Official overview may simplify year-wise allocation or describe typical later-year accommodation,Obtain current hostel-allotment circular for 2026-27,open
C002,location,airport_distance_km,S006,Approximately 7 km east of Goa Airport,S029,Map routes vary around 5–8 km,"Different campus gates, route selection and rounding",Retain 7 km as official broad distance and label travel time route-dependent,documented
C003,academics,grading experience,SX02,Repeated concern that Goa grading is comparatively strict,SX08,One recent commenter reports improved first-year grading,"Course, cohort, instructor and policy variation",Do not publish a single numeric grading-strictness score,open
C004,placements,latest_year_scope,S018,Goa-specific outcome table ends at 2022-23,S019,A 2023-24 Goa recruiter list exists without outcome statistics,Different disclosure documents and metrics,Seek a Goa-specific 2023-24 or 2024-25 outcome report before updating trend claims,open
C005,scholarships,MCN income_limit_inr,S012,Public information indicates an income condition and waiver slabs,S011,General scholarship page emphasizes coverage but may not reproduce semester notice details,Semester-specific thresholds and documentation can change,Confirm against the 2026-27 MCN notice after admission,open
