conflict_id,data_category,field,source_1_id,source_1_value,source_2_id,source_2_value,possible_reason,recommended_manual_action,status
CON001,placements,2024-25 outcome metric,SRC001,692 job offers; more than 134 companies,SRC014,NIRF reports unique students placed for earlier graduating cohorts,Different year and metric: offers can exceed unique placed students.,Obtain the final 2024-25 placement report and preserve both offer and unique-student metrics.,open
CON002,seat_matrix,UG intake scale,SRC001,"2026 JoSAA seat matrix totals 1,143 seats across 14 programmes",SRC014,NIRF submission lists historical UG four-year sanctioned intake of 855,Different years and programme scope; 2026 includes new programmes and B.Arch.,Do not compare as same-year values; retain year and programme scope.,explained
CON003,hostels,room arrangement versus guaranteed allotment,SRC001,First-year twin sharing and later single rooms described,SRC019,Detailed current allotment/guarantee terms not verified,"Profile describes typical arrangement, not a legally guaranteed entitlement.",Confirm current hostel allotment circular for the incoming batch.,open
CON004,student_experience,coding and placement culture,STU002,Brief positive campus-life report,STU001;STU005,Negative or cautious comments on coding culture and placement opportunities,"Different branches, years, expectations and self-selection bias.",Interview multiple current students from the target branch and compare with official branch-wise data.,open
CON005,fees,residential total cost,SRC001,2026 academic fee and one-time charge available,SRC020,Detailed 2026-27 hostel document not reliably extracted,Academic and hostel fees are published separately.,"Verify hostel, mess, deposits and utilities before calculating total cost.",open
