conflict_id,data_category,field,source_1_id,source_1_value,source_2_id,source_2_value,possible_reason,recommended_manual_action,status
CON001,intake,total engineering intake,SRC002,"Current 2026-27 Kattankulathur programme table totals 5,760",SRC008,"NIRF submission lists approved UG intake 5,730 for 2024-25","Different academic years, programme additions or institution/NIRF classification",Confirm the final 2026-27 AICTE approval and counselling seat matrix,open
CON002,placements,campus scope,SRC008,NIRF engineering placement counts are institution-level,SRC002,Requested dataset is Kattankulathur campus only,NIRF submission may consolidate campuses/programmes,Obtain a Kattankulathur-only placement report before campus-specific ROI claims,open
CON003,placements,2024-25 median package,SRC008,"NIRF UG four-year median INR 632,000 (6.32 LPA)",SRC012,"Annual report median salary INR 450,000 (4.5 LPA)",Different programme/campus/population and reporting definitions,Request denominator and scope definitions from placement office,open
CON004,placements,offers and recruitment activity,SRC012,"14,000+ offers, 1,052+ companies and 1,467 roles",SRC014,"14,030 offers through 2,193 recruitment drives","Rounding and different metrics (companies, roles, drives)",Use a dated placement report with metric definitions,open
CON005,scholarships,SRMJEEE rank ranges,SRC017,Generic Founder ranks 1–100 and Merit ranks 101–500 spread across phases,SRC015;SRC016,Phase-specific 2026 tables publish narrower rank ranges per phase,Generic policy describes aggregate allocation; phase tables implement each phase,Apply the phase-specific award table and verify final counselling scholarship letter,open
CON006,campus,campus area,SRC029,Older official material commonly describes Kattankulathur as approximately 250 acres,SRC012,Annual report describes nearly 466 acres of built-up/institutional area,"Kattankulathur-only versus institution-wide estate, or land versus built-up metric",Obtain a current Kattankulathur land-area statement; keep structured value null until resolved,open
CON007,identity,district,SRC024,Chengalpattu District,SRC012,Kancheepuram District in some institutional material,District reorganisation and outdated address text,Use current postal/government address: Chengalpattu; retain historical note only,open
CON008,NBA,specialisation accreditation mapping,SRC007,NBA validity is listed for selected base programmes,SRC002,Current admissions list many specialised programme names,Accreditation applies to a base programme rather than every marketed specialisation,Do not inherit base-programme NBA status without the NBA letter/programme code,open
CON009,hostel,on-campus accommodation scope,SRC022,General hostel page presents campus residential facilities,SRC020,2026 boys circular includes Green Pearl and JA Block 2 as off-campus options,Capacity management and contracted/extended accommodation,Verify exact block location and transport before booking,open
